university of washington tacoma campus,1900 Commerce St Tacoma WA 98402,(47.24609 -122.4386),$25390,$53220,628,('83%' '84%' '81%'),2233,('55%' '45%'),34%,Co-ed,('50%' '50%'),81%,4%,21%,9%,15%,1%,11%,43%
university of west alabama,Station One Livingston AL 35470,(32.584 -88.1867),$18584,$27684,351,('74%' '73%' '75%'),1539,('63%' '37%'),31%,Co-ed,('57%' '43%'),62%,4%,&lt; 1%,47%,2%,&lt; 1%,6%,44%
university of west florida uwf,11000 University Parkway Pensacola FL 32514,(30.54278 -87.21823),$17628,$30509,1159,('53%' '52%' '52%'),8660,('59%' '41%'),25%,Co-ed,('54%' '46%'),80%,3%,3%,13%,9%,1%,8%,66%
university of west georgia uwg,1601 Maple St Carrollton GA 30118,(33.57107 -85.09669),$17851,$28906,1545,('70%' '73%' '63%'),6590,('62%' '38%'),34%,Co-ed,('60%' '40%'),69%,1%,1%,37%,6%,&lt; 1%,5%,50%
university of wisconsin eau claire,105 Garfield Ave Eau Claire WI 54701,(44.79845 -91.50136),$17446,$25721,2253,('77%' '79%' '73%'),9420,('65%' '35%'),31%,Co-ed,('63%' '37%'),81%,3%,3%,1%,3%,&lt; 1%,3%,90%
university of wisconsin green bay,2420 Nicolet Dr Green Bay WI 54311,(44.53306 -87.92954),$15265,$23483,1208,('91%' '92%' '89%'),5486,('64%' '36%'),24%,Co-ed,('62%' '38%'),71%,2%,3%,2%,5%,1%,3%,86%
university of wisconsin la crosse,1725 State St La Crosse WI 54601,(43.8128 -91.23001),$15965,$24784,2217,('74%' '77%' '68%'),7067,('60%' '40%'),42%,Co-ed,('60%' '40%'),86%,1%,2%,1%,3%,&lt; 1%,3%,90%
university of wisconsin madison wisconsin,500 Lincoln Dr Madison WI 53706,(43.07403 -89.40346),$23268,$51156,8465,('60%' '64%' '56%'),53781,('51%' '49%'),26%,Co-ed,('55%' '45%'),95%,12%,7%,2%,6%,&lt; 1%,5%,80%
university of wisconsin milwaukee uwm,2200 E Kenwood Blvd Milwaukee WI 53211,(43.07552 -87.8821),$20342,$32207,3358,('89%' '89%' '88%'),14859,('59%' '41%'),25%,Co-ed,('54%' '46%'),73%,4%,7%,8%,11%,&lt; 1%,5%,69%
university of wisconsin oshkosh,800 Algoma Blvd Oshkosh WI 54901,(44.02625 -88.55169),$16491,$24064,1786,('90%' '91%' '87%'),8524,('60%' '40%'),23%,Co-ed,('57%' '43%'),78%,1%,4%,2%,5%,&lt; 1%,3%,86%
university of wisconsin parkside,900 Wood Rd Kenosha WI 53144,(42.64738 -87.8492),$15270,$23540,467,('75%' '76%' '72%'),2285,('59%' '41%'),27%,Co-ed,('62%' '38%'),71%,2%,4%,9%,16%,&lt; 1%,4%,66%
university of wisconsin platteville,1 University Plaza Platteville WI 53818,(42.73378 -90.49303),$15915,$24554,1265,('88%' '86%' '88%'),5156,('43%' '57%'),28%,Co-ed,('36%' '64%'),77%,1%,1%,2%,4%,&lt; 1%,2%,90%
university of wisconsin river falls,410 S 3rd St River Falls WI 54022,(44.85512 -92.62309),$15196,$22769,1016,('86%' '88%' '82%'),3933,('66%' '34%'),30%,Co-ed,('67%' '33%'),76%,2%,3%,2%,4%,&lt; 1%,3%,89%
university of wisconsin stevens point,2100 Main St Stevens Point WI 54481,(44.52347 -89.56888),$15971,$24675,1810,('90%' '91%' '88%'),8100,('62%' '38%'),25%,Co-ed,('56%' '44%'),73%,2%,3%,2%,4%,&lt; 1%,3%,88%
university of wisconsin stout,712 S. Broadway St. Menomonie WI 54751,(44.8763 -91.9297),$17005,$25272,1324,('91%' '91%' '91%'),4890,('47%' '53%'),30%,Co-ed,('41%' '59%'),70%,3%,4%,2%,3%,&lt; 1%,3%,88%
university of wisconsin superior,1605 Catlin Ave Superior WI 54880,(46.71951 -92.08749),$15067,$22640,341,('76%' '76%' '75%'),1805,('60%' '40%'),25%,Co-ed,('56%' '44%'),70%,10%,2%,2%,3%,2%,4%,88%
university of wisconsin whitewater,800 W Main St Whitewater WI 53190,(42.83495 -88.74386),$15480,$24352,2127,('83%' '83%' '82%'),8930,('53%' '47%'),29%,Co-ed,('46%' '54%'),82%,2%,2%,4%,6%,&lt; 1%,5%,83%
university of wyoming,Corner of Ninth and Ivinson Laramie WY 82071,(41.31212 -105.58264),$17421,$31971,1477,('97%' '97%' '96%'),5626,('50%' '50%'),27%,Co-ed,('50%' '50%'),78%,4%,1%,1%,8%,1%,16%,73%
upper iowa university,605 Washington St Fayette IA 52142,(42.83867 -91.80082),$43019,$43019,200,('65%' '63%' '65%'),1240,('37%' '63%'),25%,Co-ed,('30%' '70%'),71%,8%,2%,22%,6%,&lt; 1%,8%,61%
